{"best_ask_paise":2500010,"best_bid_paise":2500000,"canonical_instrument_id":"NSE:NSE_FNO:NIFTY:future:2026-08-27","cumulative_volume":1000,"exchange_timestamp_ns":90,"last_trade_paise":2500005,"provenance":"observed","quality_flags":[],"receive_timestamp_ns":100,"schema_version":"1.0.0","source":"dhan"}
